subject,metaphor_id,response,met_type,conceptual,nm,trial_order,met_stim,met_RT,age,sex,hand,collegeYear,SES,language_group,lang_dist,LD_rev,LD_inverse,englishAgeofOnset,AT,NFC,letter_sets,WMC,GK,LA,word_gen_pca,source_similarity_lsa,source_similarity_word2vec
48,cm1035,Some professors are unlimited idea banks.,conv,4.5,2.5,1,9,64045,28,f,right,7,3,non-english,1,3,1,12,14,5,7,33,12,12,10.3045053,0.085574314,0.131380122
48,cm1044,Some people are like mysterious boxes.,conv,5,2.5,10,8,37904,28,f,right,7,3,non-english,1,3,1,12,14,5,7,33,12,12,10.3045053,0.32370355,0.365309625
48,cm1049,Some college lectures are like stucking in an empty room.,conv,4.5,2.5,15,2,43933,28,f,right,7,3,non-english,1,3,1,12,14,5,7,33,12,12,10.3045053,,
48,cm1050,Her smile is like a candy.,conv,5,2.5,16,10,18906,28,f,right,7,3,non-english,1,3,1,12,14,5,7,33,12,12,10.3045053,-0.06695937,-0.063168195
49,cm1063,Some teenagers are like rolling balls.,conv,5,2.5,7,12,177419,33,f,right,7,3,non-english,1,3,1,12,12,5,13,46,16,11,18.4219381,0.177901972,0.216732617
50,cm1087,Divorce is a kind of illness which would have great impact on people's lives.,conv,5,2.5,9,17,109158,29,f,right,6,2,non-english,1.5,2.5,0.666666667,12,18,29,14,53,14,7,18.3753544,0.607930567,0.443866838
50,cm1089,Certain memories are just like it's on-going in front of me.,conv,3.5,2.5,11,4,28387,29,f,right,6,2,non-english,1.5,2.5,0.666666667,12,18,29,14,53,14,7,18.3753544,,
50,cm1096,Colleges is like a pot full of different people.,conv,5,2.5,18,16,39824,29,f,right,6,2,non-english,1.5,2.5,0.666666667,12,18,29,14,53,14,7,18.3753544,0.454510184,0.65220764
51,cm1109,Some teenagers are liking machine without stoping,conv,5,2.5,9,12,39909,19,f,right,2,3,bilingual,1.5,2.5,0.666666667,12,18,0,3,45,26,3,13.179676,0.14617222,0.284146332
51,cm1117,Her smile is a pretty gril,conv,2.5,2.5,17,10,23327,19,f,right,2,3,bilingual,1.5,2.5,0.666666667,12,18,0,3,45,26,3,13.179676,-0.00684462,-0.037477641
52,cm1335,friendshup is like first-rate glue,conv,5,2.5,15,20,103894,32,f,right,7,3,non-english,1.5,2.5,0.666666667,11,24,17,7,28,19,7,14.4216494,0.069455332,0.066861363
53,cm1302,Some college lectures are similar to the lullalby in my childhood which nurtures me to sleep.,conv,5,2.5,4,2,59279,17,f,right,1,3,bilingual,1.5,2.5,0.666666667,9,25,44,6,32,12,8,17.8593791,,
53,cm1306,Some relationships are the prisons.,conv,4.5,2.5,8,11,27434,17,f,right,1,3,bilingual,1.5,2.5,0.666666667,9,25,44,6,32,12,8,17.8593791,0.177960447,0.118458798
54,cm1139,friendship is like family,conv,3,2.5,17,20,58174,21,f,right,4,3,non-english,2.5,1.5,0.4,10,13,4,13,44,11,9,13.179676,0.161529143,0.208463523
55,cm1154,Her family was her refuge and strength.,conv,2.5,2.5,10,5,15314,17,f,right,1,4,bilingual,2.75,1.25,0.363636364,1,6,20,9,58,14,4,26.9945506,-0.001336614,0.223242669
55,cm1158,Some jobs feel like a prison cell that you occasionally leave and come right back to.,conv,4.5,2.5,14,1,43241,17,f,right,1,4,bilingual,2.75,1.25,0.363636364,1,6,20,9,58,14,4,26.9945506,-0.05142377,0.144662537
55,cm1159,Some professors can be seen as the harbor of all knowledge.,conv,2.5,2.5,15,9,54067,17,f,right,1,4,bilingual,2.75,1.25,0.363636364,1,6,20,9,58,14,4,26.9945506,0.098713728,0.05519139
55,cm1165,"Certain memories are are so eidetic, it feels like you are experiencing them in real time.",conv,3,2.5,21,4,47347,17,f,right,1,4,bilingual,2.75,1.25,0.363636364,1,6,20,9,58,14,4,26.9945506,,
57,cm1207,is so pretty. Like a showroom.,conv,2.5,2.5,19,22,23085,28,f,right,1,3,non-english,1.25,2.75,0.8,11,15,24,5,28,10,5,12.0971937,0.180365451,0.419566863
59,cm1241,her smile is worst than a bees trap,conv,5,2.5,9,10,35466,22,f,right,6,4,non-english,2.5,1.5,0.4,12,14,20,12,61,22,7,22.405647,0.040281877,0.034175327
1,cm8,Education is an open door. ,conv,5,2.25,8,19,62955,19,f,right,4,3,english,,0,0,0,14,10,7,49,20,9,15.5183436,0.123306051,0.095278729
1,cm17,Hearing some lectures are about as fun as watching paint dry. ,conv,5,2.25,17,2,38218,19,f,right,4,3,english,,0,0,0,14,10,7,49,20,9,15.5183436,,
7,cm136,Some old men are like children. ,conv,3.5,2.25,4,6,50067,21,f,left,4,3,english,,0,0,0,15,27,12,60,26,12,23.0550575,0.087343205,0.050949034
7,cm138,Seeing her smile is like looking at a masterpiece. ,conv,4.5,2.25,6,10,129575,21,f,left,4,3,english,,0,0,0,15,27,12,60,26,12,23.0550575,-0.009645712,0.069492045
7,cm153,Her house is like a museum. ,conv,5,2.25,21,22,12824,21,f,left,4,3,english,,0,0,0,15,27,12,60,26,12,23.0550575,0.029491583,0.245012808
8,cm162,are hidden gems of treasure  ,conv,2.5,2.25,8,21,13552,24,f,right,4,2,english,,0,0,0,7,3,8,30,19,8,17.2241805,0.312117971,0.272355228
9,cm182,Cigarettes are like malfunctioned bombs ,conv,5,2.25,6,15,82543,21,m,right,2,2,bilingual,1,3,1,6,11,0,8,37,24,9,17.303136,0.322739905,0.276855532
9,cm183,Some properties are diamond in the dust ,conv,3.5,2.25,7,21,34893,21,m,right,2,2,bilingual,1,3,1,6,11,0,8,37,24,9,17.303136,0.141219537,0.140084027
12,cm256,Some jobs are like being trapped in a box. ,conv,5,2.25,14,1,32691,20,f,right,2,3,bilingual,1.75,2.25,0.571428571,2,15,11,13,38,20,12,16.0224749,-0.116774808,0.085209675
13,cm268,Some professors are like Steven Hawking ,conv,2.5,2.25,4,9,14624,21,m,ambi,4,3,english,,0,0,0,12,17,14,38,22,11,23.5891927,0.117943098,0.002632294
13,cm276,Her Beauty is like a credit card with limitless funds ,conv,5,2.25,12,14,29925,21,m,ambi,4,3,english,,0,0,0,12,17,14,38,22,11,23.5891927,-0.031170778,0.073582088
15,cm319,Some teenagers are like a hampster on a wheel ,conv,5,2.25,11,12,36958,27,f,right,6,3,english,,0,0,0,17,40,7,53,19,8,18.4195702,0.081424629,0.155209759
15,cm325,Some college lectures are like watching paint dry ,conv,5,2.25,17,2,70209,27,f,right,6,3,english,,0,0,0,17,40,7,53,19,8,18.4195702,,
16,cm337,Education is like a stepping stool towards success ,conv,5,2.25,7,19,15390,26,m,right,6,4,bilingual,,0,0,0,11,37,10,37,27,12,34.5091566,0.301075616,0.243810857
16,cm344,Friendship is like gorilla glue ,conv,5,2.25,14,20,11025,26,m,right,6,4,bilingual,,0,0,0,11,37,10,37,27,12,34.5091566,0.058977912,0.045119152
16,cm347,Her smile is like a honey pot ,conv,5,2.25,17,10,9278,26,m,right,6,4,bilingual,,0,0,0,11,37,10,37,27,12,34.5091566,-0.028726276,-0.058846632
17,cm357,Some old men are like donkies ,conv,5,2.25,5,6,30261,28,f,right,7,3,english,,0,0,0,10,41,9,48,24,11,16.7145211,0.133167442,0.083229113
17,cm361,Her smile is like honey for bees ,conv,5,2.25,9,10,30214,28,f,right,7,3,english,,0,0,0,10,41,9,48,24,11,16.7145211,0.063792899,-0.021162734
17,cm368,Some college lectures are like watching paint dry ,conv,5,2.25,16,2,64157,28,f,right,7,3,english,,0,0,0,10,41,9,48,24,11,16.7145211,,
18,cm394,Some teenagers are like air. ,conv,5,2.25,20,12,18534,27,f,right,7,3,non-english,1,3,1,9,11,12,13,26,21,13,17.7804236,-0.001783269,0.092262364
20,cm425,His temper is like a dorment volcano on the verge of erupting. ,conv,5,2.25,7,13,64204,45,f,right,6,3,non-english,2.5,1.5,0.4,11,17,24,14,39,22,11,13.2096799,0.098026803,0.438136381
20,cm426,Cigarettes are like cancer. ,conv,4.5,2.25,8,15,35517,45,f,right,6,3,non-english,2.5,1.5,0.4,11,17,24,14,39,22,11,13.2096799,0.039656471,0.039624706
20,cm427,Divorce is like an avalanche. ,conv,5,2.25,9,17,35390,45,f,right,6,3,non-english,2.5,1.5,0.4,11,17,24,14,39,22,11,13.2096799,0.171067851,0.099091047
21,cm452,Like bees to honey. ,conv,5,2.25,12,10,43401,63,f,right,7,3,english,,0,0,0,12,4,6,53,14,6,14.3024261,0.125377099,0.036201591
22,cm471,Her smile is like a magnet. ,conv,5,2.25,9,10,50145,19,f,left,3,2,english,,0,0,0,10,23,10,33,27,12,23.546557,0.01869777,0.096934698
23,cm498,"Her family was like the home they lived in, the foundation secure and the bricks durable.  ",conv,5,2.25,14,5,66314,19,f,right,4,2,english,,0,0,0,12,-9,10,35,27,6,18.9884451,0.01613359,0.156864212
24,cm523,Some teenagers are like the Earth's rotation  ,conv,5,2.25,17,12,26754,23,m,right,6,3,english,,0,0,0,12,20,6,42,21,7,16.0651106,0.070388044,0.244025166
25,cm530,Some property's worth is like a pot of gold.  ,conv,3,2.25,2,21,168032,19,f,right,1,3,bilingual,1,3,1,3,20,10,5,15,18,6,17.1918087,0.154730992,0.14970926
25,cm546,Some people are like puzzles that are difficult to depict.  ,conv,5,2.25,18,8,19293,19,f,right,1,3,bilingual,1,3,1,3,20,10,5,15,18,6,17.1918087,0.511455722,0.518014302
26,cm554,her family is like a steal house ,conv,5,2.25,4,5,49613,19,f,right,1,3,non-english,1.5,2.5,0.666666667,4,14,30,8,31,16,8,10.9033841,-0.054596625,-0.017901175
26,cm557,love is the same as math ,conv,5,2.25,7,3,35655,19,f,right,1,3,non-english,1.5,2.5,0.666666667,4,14,30,8,31,16,8,10.9033841,0.005716616,-0.004684755
26,cm560,her house is like a model house ,conv,3,2.25,10,22,41255,19,f,right,1,3,non-english,1.5,2.5,0.666666667,4,14,30,8,31,16,8,10.9033841,0.151192806,0.28580396
27,cm584,Some property is like the crown jewels. ,conv,3.5,2.25,12,21,17661,31,m,left,5,2,english,,0,0,0,21,36,6,52,20,10,15.4741278,0.161034767,0.171348093
27,cm593,Her house is clean as a whistle.  ,conv,5,2.25,21,22,121374,31,m,left,5,2,english,,0,0,0,21,36,6,52,20,10,15.4741278,0.235671028,0.376033282
30,cm657,Some teenagers are like neutrons in an atom  ,conv,5,2.25,19,12,21611,20,m,left,2,3,english,,0,0,0,9,35,14,41,23,11,23.5710328,0.044935715,0.109540383
31,cm664,His lecture was as thrilling as watching paint dry. ,conv,4.5,2.25,4,2,63520,43,f,left,7,3,english,,0,0,0,9,60,12,58,27,10,19.5383723,,
31,cm677,Cigarettes are nothing but sticks of lit dynamite. ,conv,5,2.25,17,15,32624,43,f,left,7,3,english,,0,0,0,9,60,12,58,27,10,19.5383723,-0.071960455,-0.004363121
32,cm690,His temper is boiling water in a teapot. ,conv,5,2.25,8,13,28333,20,f,right,2,3,english,,0,0,0,9,18,10,49,19,3,18.3935143,0.087679642,0.243608566
32,cm693,Her family is stuck like glue. ,conv,4.5,2.25,11,5,25568,20,f,right,2,3,english,,0,0,0,9,18,10,49,19,3,18.3935143,0.000207062,0.056629135
34,cm729,Some property are like 24k diamonds. ,conv,3.5,2.25,3,21,61107,21,f,right,3,3,non-english,1.25,2.75,0.8,5,12,-1,11,29,19,9,14.3979614,0.151725139,0.202701673
34,cm743,Cigarettes is like how an an accident can happen to you and end your life without even knowing.  ,conv,5,2.25,17,15,48037,21,f,right,3,3,non-english,1.25,2.75,0.8,5,12,-1,11,29,19,9,14.3979614,0.245442075,0.257879893
35,cm752,divorce is like a virus ,conv,5,2.25,4,17,72672,20,f,right,3,3,non-english,2,2,0.5,10,12,-7,9,30,12,3,16.0887986,0.183244643,0.20571468
35,cm754,some professors can be like bill nye  ,conv,2.5,2.25,6,9,50874,20,f,right,3,3,non-english,2,2,0.5,10,12,-7,9,30,12,3,16.0887986,0.086617427,-0.004560605
35,cm770,her beauty is like a magnet ,conv,5,2.25,22,14,30013,20,f,right,3,3,non-english,2,2,0.5,10,12,-7,9,30,12,3,16.0887986,-0.052429403,0.023799765
36,cm784,Divorces are like the mother of all bombs  ,conv,5,2.25,14,17,15473,20,f,right,3,2,bilingual,2.25,1.75,0.444444444,3,6,18,10,23,23,10,14.8934089,0.325945677,0.277087743
37,cm795,some jobs are like a straight jacket ,conv,5,2.25,3,1,39334,19,f,right,3,3,english,,0,0,0,10,6,14,43,19,10,21.3231647,-0.099283044,-0.041770266
38,cm819,Some property is like the diamonds of real estate. ,conv,4.5,2.25,5,21,26898,19,m,right,3,4,english,,0,0,0,14,4,11,56,24,11,13.2080998,0.152909199,0.255040377
38,cm825,Some college lectures are like watching grass grow. ,conv,5,2.25,11,2,21515,19,m,right,3,4,english,,0,0,0,14,4,11,56,24,11,13.2080998,,
38,cm829,Certain memories are like novels. ,conv,5,2.25,15,4,24067,19,m,right,3,4,english,,0,0,0,14,4,11,56,24,11,13.2080998,,
39,cm846,some teenagers are like crazy monkies,conv,5,2.25,10,12,19935,36,f,right,7,3,non-english,1,3,1,10,14,22,6,29,13,12,18.4298341,0.083921732,0.093544033
39,cm849,divorce is like having severe disease,conv,5,2.25,13,17,71647,36,f,right,7,3,non-english,1,3,1,10,14,22,6,29,13,12,18.4298341,0.215527567,0.233505862
39,cm854,some jobs are like having a wall,conv,5,2.25,18,1,31134,36,f,right,7,3,non-english,1,3,1,10,14,22,6,29,13,12,18.4298341,-0.086725487,0.050332534
39,cm856,friendship is like gluing people ,conv,5,2.25,20,20,43470,36,f,right,7,3,non-english,1,3,1,10,14,22,6,29,13,12,18.4298341,0.560926339,0.409147264
39,cm857,her family is like a big tree ,conv,5,2.25,21,5,30187,36,f,right,7,3,non-english,1,3,1,10,14,22,6,29,13,12,18.4298341,-0.021501702,0.005650361
40,cm865,Freidnship is like a sturdy rope.,conv,5,2.25,7,20,38749,24,m,right,6,3,bilingual,1,3,1,17,8,15,8,40,18,12,14.9581525,0.011310279,0.069535849
40,cm875,Her smile is like honey.,conv,5,2.25,17,10,15449,24,m,right,6,3,bilingual,1,3,1,17,8,15,8,40,18,12,14.9581525,-0.035887234,-0.08409577
42,cm903,He is like a water balloon ,conv,5,2.25,1,13,179487,38,f,right,6,2,non-english,2.25,1.75,0.444444444,8,16,5,14,36,16,7,20.1577789,0.099994924,0.302449985
42,cm904,That job is like being in solitary confinement  ,conv,4.5,2.25,2,1,142777,38,f,right,6,2,non-english,2.25,1.75,0.444444444,8,16,5,14,36,16,7,20.1577789,-0.082874985,0.249681402
42,cm906,Her family is like a bunker  ,conv,5,2.25,4,5,176072,38,f,right,6,2,non-english,2.25,1.75,0.444444444,8,16,5,14,36,16,7,20.1577789,-0.024142569,-0.008959193
42,cm909,He is like  a goat  ,conv,5,2.25,7,6,26366,38,f,right,6,2,non-english,2.25,1.75,0.444444444,8,16,5,14,36,16,7,20.1577789,0.030890955,0.145397211
43,cm939,Some jobs lock you in a box and throw away the key. ,conv,5,2.25,15,1,12855,26,f,right,6,3,english,,0,0,0,11,21,10,56,26,11,26.4825233,-0.110562608,0.076385678
45,cm987,Her smile is like honey to bees,conv,5,2.25,19,10,18093,20,f,right,3,2,english,,0,0,0,4,38,12,39,23,6,14.9336767,0.063792899,-0.021162734
47,cm1029,Her smile is like the sun shining on sunflowers.,conv,5,2.25,17,10,171033,39,f,right,6,4,non-english,1,3,1,12,23,45,12,50,23,11,17.2076007,-0.010256686,-0.015951481
48,cm1036,Her beauty is her key of everything.,conv,4.5,2.25,2,14,22832,28,f,right,7,3,non-english,1,3,1,12,14,5,7,33,12,12,10.3045053,-0.013876154,0.059134618
48,cm1037,Certain memories are like pictures.,conv,3,2.25,3,4,24424,28,f,right,7,3,non-english,1,3,1,12,14,5,7,33,12,12,10.3045053,,
48,cm1042,Her family is like a really tall and thick tree.,conv,5,2.25,8,5,39111,28,f,right,7,3,non-english,1,3,1,12,14,5,7,33,12,12,10.3045053,-0.034372372,0.005403966
48,cm1056,Some old men are like walls.,conv,5,2.25,22,6,13777,28,f,right,7,3,non-english,1,3,1,12,14,5,7,33,12,12,10.3045053,0.091151589,0.065454582
49,cm1064,Cretain memories are like 4D IMAX movies. ,conv,4,2.25,8,4,78872,33,f,right,7,3,non-english,1,3,1,12,12,5,13,46,16,11,18.4219381,,
49,cm1067,Some people are like riddles.,conv,5,2.25,11,8,72473,33,f,right,7,3,non-english,1,3,1,12,12,5,13,46,16,11,18.4219381,0.541980824,0.448461924
49,cm1069,Some professors are like walking wikipedias.,conv,5,2.25,13,9,31332,33,f,right,7,3,non-english,1,3,1,12,12,5,13,46,16,11,18.4219381,0.105039365,0.018041831
50,cm1094,Some teenagers are travelling like vehciles without traffic lights.,conv,5,2.25,16,12,60219,29,f,right,6,2,non-english,1.5,2.5,0.666666667,12,18,29,14,53,14,7,18.3753544,0.075914586,0.268435595
51,cm1112,Colleges are samll world,conv,5,2.25,12,16,16193,19,f,right,2,3,bilingual,1.5,2.5,0.666666667,12,18,0,3,45,26,3,13.179676,0.127207206,0.215805315
51,cm1120,Some old men are like oxes,conv,5,2.25,20,6,17071,19,f,right,2,3,bilingual,1.5,2.5,0.666666667,12,18,0,3,45,26,3,13.179676,0.139588827,0.117333999
53,cm1314,Some old men is hard-headed teenagers.,conv,2.5,2.25,16,6,52775,17,f,right,1,3,bilingual,1.5,2.5,0.666666667,9,25,44,6,32,12,8,17.8593791,0.123090307,0.08594812
53,cm1319,Education is a key to a house full of gold.,conv,5,2.25,21,19,28374,17,f,right,1,3,bilingual,1.5,2.5,0.666666667,9,25,44,6,32,12,8,17.8593791,0.072330631,0.201477261
54,cm1132,her house is like a hospital room,conv,4.5,2.25,10,22,46397,21,f,right,4,3,non-english,2.5,1.5,0.4,10,13,4,13,44,11,9,13.179676,0.115831633,0.27492307
54,cm1144,divorce is like a hurricane for families,conv,5,2.25,22,17,59324,21,f,right,4,3,non-english,2.5,1.5,0.4,10,13,4,13,44,11,9,13.179676,0.351938958,0.274641802
55,cm1145,Divorce is like a destructive tornado.,conv,5,2.25,1,17,38945,17,f,right,1,4,bilingual,2.75,1.25,0.363636364,1,6,20,9,58,14,4,26.9945506,0.301137937,0.340275395
56,cm1173,Her smile is like a magnet,conv,5,2.25,7,10,10805,19,m,left,1,3,non-english,2.25,1.75,0.444444444,5,15,10,12,34,15,11,10.3124013,0.01869777,0.096934698
56,cm1177,"The earth is like an office, people running around doing a lot of things",conv,2,2.25,11,18,105684,19,m,left,1,3,non-english,2.25,1.75,0.444444444,5,15,10,12,34,15,11,10.3124013,0.57217168,0.597667058
56,cm1183,His temper is like a timed bomb,conv,5,2.25,17,13,24436,19,m,left,1,3,non-english,2.25,1.75,0.444444444,5,15,10,12,34,15,11,10.3124013,0.173541328,0.251867462
56,cm1188,Her family is strong like a well built building,conv,5,2.25,22,5,48562,19,m,left,1,3,non-english,2.25,1.75,0.444444444,5,15,10,12,34,15,11,10.3124013,0.059586748,0.186108065
58,cm1212,Some teenagers are like highspeed train.,conv,5,2.25,2,12,71784,34,f,left,7,3,bilingual,1.25,2.75,0.8,3,24,55,6,62,19,8,23.0447936,0.038438964,0.085506658
59,cm1252,some college lectures turn up to be nap times,conv,5,2.25,20,2,50685,22,f,right,6,4,non-english,2.5,1.5,0.4,12,14,20,12,61,22,7,22.405647,,
60,cm1271,Her smile is like honey.,conv,5,2.25,17,10,8706,18,f,right,2,2,english,,0,0,0,7,64,6,32,23,7,18.9134376,-0.035887234,-0.08409577
60,cm1274,Her family is like a house built of stone.,conv,5,2.25,20,5,31891,18,f,right,2,2,english,,0,0,0,7,64,6,32,23,7,18.9134376,-0.044259625,0.027298547
61,cm1277,using some computer programs is like solving a trigonometry problem,conv,4,2.25,1,7,82032,21,m,right,3,3,non-english,2.5,1.5,0.4,6,15,3,10,50,16,12,16.6576735,0.384878734,0.431254625
61,cm1289,her family is like a secure castle for her,conv,5,2.25,13,5,15096,21,m,right,3,3,non-english,2.5,1.5,0.4,6,15,3,10,50,16,12,16.6576735,0.033861187,0.097825845
1,cm5,Some computer programs are literally rocket science. ,conv,3,2,5,7,84320,19,f,right,4,3,english,,0,0,0,14,10,7,49,20,9,15.5183436,0.151811056,0.188132069
1,cm6,His temper is like a boiling pot. ,conv,5,2,6,13,14118,19,f,right,4,3,english,,0,0,0,14,10,7,49,20,9,15.5183436,0.003605698,0.138441547
1,cm7,Cigarettes are assassins. ,conv,5,2,7,15,80638,19,f,right,4,3,english,,0,0,0,14,10,7,49,20,9,15.5183436,0.119110056,0.100522512
1,cm9,Jobs can be a prison for some. ,conv,4.5,2,9,1,61382,19,f,right,4,3,english,,0,0,0,14,10,7,49,20,9,15.5183436,0.090993143,0.183288071
1,cm12,Her beauty is currency. ,conv,5,2,12,14,13544,19,f,right,4,3,english,,0,0,0,14,10,7,49,20,9,15.5183436,-0.061271136,0.089704879
1,cm13,The Earth is like a hive. ,conv,3,2,13,18,12615,19,f,right,4,3,english,,0,0,0,14,10,7,49,20,9,15.5183436,0.011439158,0.146852736
1,cm15,Memories are like stories.  ,conv,3,2,15,4,24221,19,f,right,4,3,english,,0,0,0,14,10,7,49,20,9,15.5183436,,
1,cm19,Friendships are bonds. ,conv,2,2,19,20,7317,19,f,right,4,3,english,,0,0,0,14,10,7,49,20,9,15.5183436,0.018400037,0.093815334
1,cm20,"To some, their things are like jewels. ",conv,2.5,2,20,21,63115,19,f,right,4,3,english,,0,0,0,14,10,7,49,20,9,15.5183436,0.088013102,0.109984576
1,cm21,Going through divorce is like dealing with a storm. ,conv,5,2,21,17,20480,19,f,right,4,3,english,,0,0,0,14,10,7,49,20,9,15.5183436,0.258022717,0.240619726
2,cm34,His temper is a volcano. ,conv,5,2,12,13,9159,22,f,right,4,3,english,,0,0,0,12,-5,8,46,17,6,23.0447936,0.04974513,0.231611063
2,cm37,Divorce is cancer. ,conv,5,2,15,17,12940,22,f,right,4,3,english,,0,0,0,12,-5,8,46,17,6,23.0447936,0.167597166,0.163258872
2,cm38,Some property are similar to diamonds. ,conv,3.5,2,16,21,72974,22,f,right,4,3,english,,0,0,0,12,-5,8,46,17,6,23.0447936,0.167295775,0.233921034
2,cm40,Love is marriage. ,conv,2.5,2,18,3,19778,22,f,right,4,3,english,,0,0,0,12,-5,8,46,17,6,23.0447936,0.061901788,0.0545804
2,cm42,Some people are brick walls. ,conv,5,2,20,8,10607,22,f,right,4,3,english,,0,0,0,12,-5,8,46,17,6,23.0447936,0.222320586,0.221592475
3,cm52,Her beauty is like a no-limit credit card ,conv,5,2,8,14,87143,30,m,left,7,3,english,,0,0,0,16,31,14,52,25,13,17.8412192,0.017269647,0.132521642
3,cm54,The earth is like beehive ,conv,3,2,10,18,28832,30,m,left,7,3,english,,0,0,0,16,31,14,52,25,13,17.8412192,0.014091259,0.096624288
3,cm64,Divorce is like an atom bomb dropped ,conv,5,2,20,17,52782,30,m,left,7,3,english,,0,0,0,16,31,14,52,25,13,17.8412192,0.187815041,0.185505499
4,cm68,Her beauty is her ticket to happiness ,conv,5,2,2,14,48152,19,f,right,3,3,english,,0,0,0,3,14,7,54,23,9,16.6758334,0.037730685,0.146396444
4,cm71,Some property is pure gold ,conv,3,2,5,21,24622,19,f,right,3,3,english,,0,0,0,3,14,7,54,23,9,16.6758334,0.166326398,0.233911696
4,cm73,Her family is her rock ,conv,5,2,7,5,7548,19,f,right,3,3,english,,0,0,0,3,14,7,54,23,9,16.6758334,0.005704524,-0.097476988
4,cm76,Some people are as hard to read as a closed book ,conv,5,2,10,8,41413,19,f,right,3,3,english,,0,0,0,3,14,7,54,23,9,16.6758334,0.428503069,0.632522217
4,cm77,Divorce is like a tsunami ,conv,5,2,11,17,17146,19,f,right,3,3,english,,0,0,0,3,14,7,54,23,9,16.6758334,0.235983347,0.219769137
4,cm80,Certain memories are like movies ,conv,3.5,2,14,4,96036,19,f,right,3,3,english,,0,0,0,3,14,7,54,23,9,16.6758334,,
4,cm81,Colleges are like a melting pot ,conv,4.5,2,15,16,47269,19,f,right,3,3,english,,0,0,0,3,14,7,54,23,9,16.6758334,-0.001642428,0.090533503
4,cm85,His temper is like a ticking time bomb ,conv,5,2,19,13,13259,19,f,right,3,3,english,,0,0,0,3,14,7,54,23,9,16.6758334,0.184780479,0.273207706
4,cm88,Some professors are like walking encyclopedias ,conv,5,2,22,9,92472,19,f,right,3,3,english,,0,0,0,3,14,7,54,23,9,16.6758334,0.091854062,0.041571289
6,cm128,"With some jobs, the psychological line between prisoner's cell and cubicle becomes immensely blurred. ",conv,4.5,2,18,1,39799,27,m,right,7,3,english,,0,0,0,13,28,9,52,26,12,21.2986889,-0.033937761,0.235344784
7,cm134,A divorce can sometimes be like a tsunami. ,conv,5,2,2,17,52479,21,f,left,4,3,english,,0,0,0,15,27,12,60,26,12,23.0550575,0.235983347,0.207081837
7,cm140,Having her beauty is like having a free pass to everything. ,conv,5,2,8,14,130503,21,f,left,4,3,english,,0,0,0,15,27,12,60,26,12,23.0550575,-0.00615,0.119004567
7,cm146,Friendship is like super glue. ,conv,5,2,14,20,29323,21,f,left,4,3,english,,0,0,0,15,27,12,60,26,12,23.0550575,0.047092234,0.086729931
7,cm148,Some professors are like Einstein. ,conv,2.5,2,16,9,31683,21,f,left,4,3,english,,0,0,0,15,27,12,60,26,12,23.0550575,0.074563432,-0.012253464
7,cm149,Getting a good education is like winning the lottery. ,conv,5,2,17,19,112324,21,f,left,4,3,english,,0,0,0,15,27,12,60,26,12,23.0550575,0.515021172,0.493814948
8,cm155,like a ticking time bomb ,conv,5,2,1,13,20777,24,f,right,4,2,english,,0,0,0,7,3,8,30,19,8,17.2241805,0.181409154,0.296065352
8,cm169,is as clean as a whistle  ,conv,5,2,15,22,9377,24,f,right,4,2,english,,0,0,0,7,3,8,30,19,8,17.2241805,0.270301078,0.31496948
8,cm173,the glue that keeps people stuck together ,conv,5,2,19,20,21463,24,f,right,4,2,english,,0,0,0,7,3,8,30,19,8,17.2241805,0.694568882,0.638537419
8,cm174,are solid as a rock ,conv,5,2,20,5,7500,24,f,right,4,2,english,,0,0,0,7,3,8,30,19,8,17.2241805,0.042389965,0.018635354
8,cm176,is full of busy swarming ants ,conv,5,2,22,18,22281,24,f,right,4,2,english,,0,0,0,7,3,8,30,19,8,17.2241805,0.399329448,0.519373138
9,cm177,Some jobs are like jail ,conv,4.5,2,1,1,15088,21,m,right,2,2,bilingual,1,3,1,6,11,0,8,37,24,9,17.303136,-0.073893621,0.048847308
9,cm185,The Earth is like a colony of ants ,conv,3.5,2,9,18,34523,21,m,right,2,2,bilingual,1,3,1,6,11,0,8,37,24,9,17.303136,-0.006086813,0.030118595
9,cm187,Her family is like a lock ,conv,5,2,11,5,36950,21,m,right,2,2,bilingual,1,3,1,6,11,0,8,37,24,9,17.303136,0.070757473,0.0962004
9,cm188,Some computer programs are rocket science  ,conv,3,2,12,7,12922,21,m,right,2,2,bilingual,1,3,1,6,11,0,8,37,24,9,17.303136,0.149779619,0.158400542
9,cm190,Some old men are like mule ,conv,5,2,14,6,15986,21,m,right,2,2,bilingual,1,3,1,6,11,0,8,37,24,9,17.303136,0.153888999,0.116442085
9,cm194,Some teenagers like like the wind ,conv,5,2,18,12,8569,21,m,right,2,2,bilingual,1,3,1,6,11,0,8,37,24,9,17.303136,0.106420657,0.193770447
10,cm200,Some professors are like Einstein ,conv,2,2,2,9,11671,20,m,ambi,2,3,non-english,1.5,2.5,0.666666667,5,20,8,9,33,18,7,12.0285021,0.074563432,-0.012253464
10,cm207,Education is the key to success  ,conv,5,2,9,19,26265,20,m,ambi,2,3,non-english,1.5,2.5,0.666666667,5,20,8,9,33,18,7,12.0285021,0.329132809,0.36020648
10,cm212,Divorce is like war ,conv,5,2,14,17,7521,20,m,ambi,2,3,non-english,1.5,2.5,0.666666667,5,20,8,9,33,18,7,12.0285021,0.268315976,0.267689384
10,cm214,Her beauty is a credit card ,conv,5,2,16,14,6960,20,m,ambi,2,3,non-english,1.5,2.5,0.666666667,5,20,8,9,33,18,7,12.0285021,0.017269647,0.132521642
10,cm215,Some teenagers are racecars ,conv,5,2,17,12,79082,20,m,ambi,2,3,non-english,1.5,2.5,0.666666667,5,20,8,9,33,18,7,12.0285021,0.020657665,0.022068769
10,cm216,Her smile is a magnet ,conv,5,2,18,10,10230,20,m,ambi,2,3,non-english,1.5,2.5,0.666666667,5,20,8,9,33,18,7,12.0285021,0.01869777,0.096934698
10,cm219,True friendship is an unbreakable bond ,conv,2.5,2,21,20,50040,20,m,ambi,2,3,non-english,1.5,2.5,0.666666667,5,20,8,9,33,18,7,12.0285021,0.059346236,0.153258381
11,cm224,His temper reminded me of a ticking time bomb. ,conv,5,2,4,13,18223,21,f,right,3,3,bilingual,,0,0,0,17,18,9,62,19,12,20.6571744,0.179797538,0.212561246
11,cm242,"Friendship is a test of time, but can be lifelong if given effort. ",conv,2,2,22,20,70287,21,f,right,3,3,bilingual,,0,0,0,17,18,9,62,19,12,20.6571744,0.233427205,0.390035725
12,cm243,Certain memories are like watching a movie. ,conv,3.5,2,1,4,110008,20,f,right,2,3,bilingual,1.75,2.25,0.571428571,2,15,11,13,38,20,12,16.0224749,,
